{
  "contract": {
    "id": "CT-DEC-001",
    "version": "1.0.0"
  },
  "decision_context_id": "DCTX-2026-000001",
  "request_id": "REQ-2026-000001",
  "request_type": "existing_article_improvement",
  "subjects": [
    {
      "subject_id": "title",
      "component": "seo_title",
      "current_state": "現行タイトル",
      "metrics": {
        "ctr": 0.002
      },
      "quality_issues": []
    }
  ],
  "constraints": [
    "既存価値を維持する"
  ],
  "available_evidence": [
    "performance_data",
    "source_snapshot"
  ],
  "created_at": "2026-07-17T04:00:00+09:00"
}
